"SKU","ID","Tipo","Nombre","Precio normal","_bgm_min_1","_bgm_descuento_1","_bgm_min_2","_bgm_descuento_2","_bgm_modo_descuento","reglas"
"8588988939601","24760","simple","Accesorio Para Moño Facil Ref:93960","1000","3","250","12","500","unico","#8 Descuento lote 250 ; #66 Descuento Nivel II lote 500"
"8588988939762","24759","simple","Accesorio Para Trenza Facil Ref:93976","800","3","250","12","500","unico","#8 Descuento lote 250 ; #66 Descuento Nivel II lote 500"
"6944959253923","40408","simple","Aceite Capilar Argan  Obopekal 70Ml","3490","3","500",,,"unico","#19 Descuento lote 500"
"9571891204545","11640","simple","Aceite Capilar Argan Expert Line","3490","3","800","12","1500","unico","#31 Descuento lote 800 ; #113 Descuento Nivel II lote 1500"
"7804676440056","6714","simple","Aceite Capilar Caballo Mflora","2990","3","800","12","1200","unico","#31 Descuento lote 800 ; #104 Descuento Nivel II lote 1200"
"6944959246116","23423","simple","Aceite Capilar Caballo Obopekal 70Ml","3490","3","500",,,"unico","#19 Descuento lote 500"
"7804666440087","2015","simple","Aceite Capilar De Almendras Mflora","2990","3","800","12","1200","unico","#31 Descuento lote 800 ; #104 Descuento Nivel II lote 1200"
"7804666440131","16331","simple","Aceite Capilar De Aloe Vera Mflora","2990","3","800","12","1200","unico","#31 Descuento lote 800 ; #104 Descuento Nivel II lote 1200"
"7804666440032","3907","simple","Aceite Capilar De Argan Mflora","2990","3","800","12","1200","unico","#31 Descuento lote 800 ; #104 Descuento Nivel II lote 1200"
"7804666440162","16330","simple","Aceite Capilar De Coco Karite Mflora","2990","3","800","12","1200","unico","#31 Descuento lote 800 ; #104 Descuento Nivel II lote 1200"
"7804666440018","2088","simple","Aceite Capilar De Coco Mflora","2990","3","800","12","1200","unico","#31 Descuento lote 800 ; #104 Descuento Nivel II lote 1200"
"7804666440100","3249","simple","Aceite Capilar De Ricino Mflora","2990","3","800","12","1200","unico","#31 Descuento lote 800 ; #104 Descuento Nivel II lote 1200"
"6323956010058","23863","simple","Aceite Capilar Hello Kitty Con Glitter","3890","3","600","12","1000","unico","#24 Descuento lote 600 ; #95 Descuento Nivel II lote 1000"
"9571891202527","39885","simple","Aceite Capilar Jojoba Expert line","3490","3","800","12","1500","unico","#31 Descuento lote 800 ; #113 Descuento Nivel II lote 1500"
"77385558656532","6715","simple","Aceite Capilar Keratine Choc Mflora","2990","3","800","12","1200","unico","#31 Descuento lote 800 ; #104 Descuento Nivel II lote 1200"
"9571891205559","12032","simple","Aceite Capilar Marroqui Expert Line","3490","3","800","12","1500","unico","#31 Descuento lote 800 ; #113 Descuento Nivel II lote 1500"
"7804666440186","16334","simple","Aceite Capilar Matizador Mflora","2990","3","800","12","1200","unico","#31 Descuento lote 800 ; #104 Descuento Nivel II lote 1200"
"9576721257524","12031","simple","Aceite Capilar Monoi Expert Line","3490","3","800","12","1500","unico","#31 Descuento lote 800 ; #113 Descuento Nivel II lote 1500"
"7804666440094","11652","simple","Aceite Capilar Palta Mflora","2990","3","800","12","1200","unico","#31 Descuento lote 800 ; #104 Descuento Nivel II lote 1200"
"9571891203531","11639","simple","Aceite Capilar Ricino Expert Line","3490","3","800","12","1500","unico","#31 Descuento lote 800 ; #113 Descuento Nivel II lote 1500"
"78046666440193","11654","simple","Aceite Capilar Romero Oliva Mflora","2990","3","800","12","1200","unico","#31 Descuento lote 800 ; #104 Descuento Nivel II lote 1200"
"78046666440070","11653","simple","Aceite Capilar Rosa Mosqueta Mflora","2990","3","800","12","1200","unico","#31 Descuento lote 800 ; #104 Descuento Nivel II lote 1200"
"6974549383464","22666","variable","Aceite Corporal Shimmer Misucka 50Ml","","3","1000","12","1690","unico","#37 Descuento lote 1000 ; #116 Descuento Nivel II lote 1690"
"7804666440124","16333","simple","Aceite De Acido Capilar Mflora","2990","3","800","12","1200","unico","#31 Descuento lote 800 ; #104 Descuento Nivel II lote 1200"
"7805800560029","39771","simple","Aceite de Cutículas Coconut Cherimoya 15ml","2990","3","500","12","1000","unico","#19 Descuento lote 500 ; #95 Descuento Nivel II lote 1000"
"760412335922","33403","simple","Aceite de Labios Frutal Max Belle","1000","3","250","12","450","unico","#8 Descuento lote 250 ; #62 Descuento Nivel II lote 450"
"6952743800574","23505","variable","Aceite De Masajes Hidratante Corporal 220Ml","","3","500","12","1000","unico","#19 Descuento lote 500 ; #95 Descuento Nivel II lote 1000"
"6929534001373","6345","simple","Aceite De Ricino Para Pestañas Y Cabello","2990","3","800","12","1200","unico","#31 Descuento lote 800 ; #104 Descuento Nivel II lote 1200"
"8800577018291","38956","variable","Aceite Labial Caring","","3","500","12","1000","unico","#19 Descuento lote 500 ; #95 Descuento Nivel II lote 1000"
"8800577018284","38939","variable","Aceite Labial Fresh Kiss","","3","500","12","1000","unico","#19 Descuento lote 500 ; #95 Descuento Nivel II lote 1000"
"7804666440179","16332","simple","Aceite Para Barba Mflora","2990","3","800","12","1200","unico","#31 Descuento lote 800 ; #104 Descuento Nivel II lote 1200"
"77386350660310","40700","simple","Acondicionador Bomba de Keratina","3490","3","800","12","1500","unico","#31 Descuento lote 800 ; #113 Descuento Nivel II lote 1500"
"9571981120519","40790","simple","Acondicionador Expert Line Argan","3490","3","800",,,"unico","#31 Descuento lote 800"
"9576721249758","40788","simple","Acondicionador Expert Line Jojoba & Argan","3490","3","800","12","1500","unico","#31 Descuento lote 800 ; #113 Descuento Nivel II lote 1500"
"9577821025433","40786","simple","Acondicionador Expert Line Marroqui","3490","3","800","12","1500","unico","#31 Descuento lote 800 ; #113 Descuento Nivel II lote 1500"
"9576721073063","40784","simple","Acondicionador Expert Line Monoi","3490","3","800","12","1500","unico","#31 Descuento lote 800 ; #113 Descuento Nivel II lote 1500"
"9576721065297","16824","simple","Acondicionador Expert Line Ricino","3490","3","800","12","1500","unico","#31 Descuento lote 800 ; #113 Descuento Nivel II lote 1500"
"6323956011260","3175","simple","Acondicionador Kids Bubbaluu Frutilla","3890","3","600","12","1000","unico","#24 Descuento lote 600 ; #95 Descuento Nivel II lote 1000"
"6323956011291","31447","simple","Acondicionador Kids Bubbaluu Tuti Fruti","3890","3","600","12","1000","unico","#24 Descuento lote 600 ; #95 Descuento Nivel II lote 1000"
"6323956011307","31448","simple","Acondicionador Kids Bubbaluu Uva","3890","3","600","12","1000","unico","#24 Descuento lote 600 ; #95 Descuento Nivel II lote 1000"
"9720342764798","35465","simple","Acondicionador Nano Btx Brasil Cacau 450ml","3990","3","800","12","1400","unico","#31 Descuento lote 800 ; #110 Descuento Nivel II lote 1400"
"6323956020910","34816","simple","Agua de Rosas Bubbaluu 120ml","3500","3","500","12","1300","unico","#19 Descuento lote 500 ; #108 Descuento Nivel II lote 1300"
"7804666446003","16328","variable","Agua Oxigenada Mflora 1000Cc","","3","1000","12","1400","unico","#37 Descuento lote 1000 ; #110 Descuento Nivel II lote 1400"
"8588988939779","24761","simple","Aguja De Cabello Para Peinados Ref:93977","600","3","200","12","400","unico","#6 Descuento lote 200 ; #144 Descuento Nivel II lote 400"
"6929534001328","17382","simple","Alcohol 70° 500Cc Paychris","3790","3","600","12","1200","unico","#24 Descuento lote 600 ; #104 Descuento Nivel II lote 1200"
"9669669804773","17424","simple","Algodón 100Unid","1990","3","500","12","1000","unico","#19 Descuento lote 500 ; #95 Descuento Nivel II lote 1000"
"6925977028885","17423","simple","Algodón 50Unid","1490","3","500","12","1000","unico","#19 Descuento lote 500 ; #95 Descuento Nivel II lote 1000"
"77394517496513","11355","simple","Alisante Kera Plex","3990","3","900","12","1600","unico","#35 Descuento lote 900 ; #115 Descuento Nivel II lote 1600"
"77394557819716","11361","simple","Alisante Lumi Plex","3990","3","900",,,"unico","#35 Descuento lote 900"
"8588988998103","25400","simple","Almohadilla De Silicona Para Pestañas","1590,00","3","400","12","700","unico","#14 Descuento lote 400 ; #77 Descuento Nivel II lote 700"
"6323956013585","41275","simple","Ampolla Capilar Hidratante Bubbaluu Hidratación Intensa","2500","3","500","12","1000","unico","#19 Descuento lote 500 ; #95 Descuento Nivel II lote 1000"
"6323956013509","41271","simple","Ampolla Capilar Hidratante Bubbaluu Para Cabellos secos","2500","3","500","12","1000","unico","#19 Descuento lote 500 ; #95 Descuento Nivel II lote 1000"
"6323956013387","41268","simple","Ampolla Capilar Hidratante Bubbaluu Protección térmica","2500","3","500","12","1000","unico","#19 Descuento lote 500 ; #95 Descuento Nivel II lote 1000"
"6323956013615","41262","simple","Ampolla Capilar Hidratante Bubbaluu Restauración & Suavidad","2500","3","500","12","1000","unico","#19 Descuento lote 500 ; #95 Descuento Nivel II lote 1000"
"7822456320968","17370","simple","Anillo Mezclador","890","3","300","12","500","unico","#9 Descuento lote 300 ; #66 Descuento Nivel II lote 500"
"8588988783938","17542","variable","Anillo Para Pegamento Circulo 50Pcs","","3","400","12","700","unico","#14 Descuento lote 400 ; #77 Descuento Nivel II lote 700"
"8588988783921","17543","variable","Anillo Para Pegamento Corazón 50 Pcs","","3","400","12","700","unico","#14 Descuento lote 400 ; #77 Descuento Nivel II lote 700"
"85889810974348","25408","variable","Antifaz Para Dormir De Gatito Ref:97434","","3","500","12","1000","unico","#19 Descuento lote 500 ; #95 Descuento Nivel II lote 1000"
"8588981010604","25405","variable","Antifaz Para Dormir Osito Ref:101060","","3","500","12","1000","unico","#19 Descuento lote 500 ; #95 Descuento Nivel II lote 1000"
"8588981010666","25404","variable","Antifaz Para Dormir Panda Ref: 101066","","3","500","12","1000","unico","#19 Descuento lote 500 ; #95 Descuento Nivel II lote 1000"
"760412310004","28945","simple","Antipelusa de uñas Max belle","2500","3","510","12","1000","unico","#20 Descuento lote 510 ; #95 Descuento Nivel II lote 1000"
"760412262464","23518","simple","Aplicador De Labios Set De 50Unid","2200","3","500","12","1000","unico","#19 Descuento lote 500 ; #95 Descuento Nivel II lote 1000"
"8800577001088","26769","simple","Arcilla Moldeadora Mate Flamenco","2300,00","3","500","12","1000","unico","#19 Descuento lote 500 ; #95 Descuento Nivel II lote 1000"
"6944959244785","16230","simple","Balsamo Argan Morocco 800Ml Obopekal","4990","3","500",,,"unico","#19 Descuento lote 500"
"77411237771965","23289","simple","Balsamo Bichota Everglam 500Ml","3690","3","800","12","1400","unico","#31 Descuento lote 800 ; #110 Descuento Nivel II lote 1400"
"77392940740585","12045","simple","Bálsamo Biotina Copacabana 500ml","3490","3","800","12","1500","unico","#31 Descuento lote 800 ; #113 Descuento Nivel II lote 1500"
"77386548210196","5775","simple","Balsamo Bomba Magia De Unicornio","3490","3","800","12","1500","unico","#31 Descuento lote 800 ; #113 Descuento Nivel II lote 1500"
"6323956010980","37995","simple","Balsamo Bubbaluu Frutilla 350ml","3690","3","600","12","1000","unico","#24 Descuento lote 600 ; #95 Descuento Nivel II lote 1000"
"6323956010010","26921","simple","Balsamo Bubbaluu Tuttifrutti 350ml","3690","3","600","12","1000","unico","#24 Descuento lote 600 ; #95 Descuento Nivel II lote 1000"
"6323956010034","29856","simple","Balsamo Bubbaluu Uva 350ml","3690","3","600","12","1000","unico","#24 Descuento lote 600 ; #95 Descuento Nivel II lote 1000"
"77393083286259","9023","simple","Balsamo Cabello Rizos Copacabana 500ml","3490","3","800","12","1500","unico","#31 Descuento lote 800 ; #113 Descuento Nivel II lote 1500"
"77410109943350","12047","simple","Balsamo Camomilla Copacabana 500ml","3490","3","800","12","1500","unico","#31 Descuento lote 800 ; #113 Descuento Nivel II lote 1500"
"77428142584692","23885","simple","Balsamo De Caballo Reania 500Ml","3990",,,"12","1000","unico","#95 Descuento Nivel II lote 1000"
"77428913559897","23865","simple","Balsamo De Carbon Reania 500Ml","3990","3","600","12","1000","unico","#24 Descuento lote 600 ; #95 Descuento Nivel II lote 1000"
"77410133837297","23396","simple","Balsamo De Cebolla Reania 500Ml","3990","3","600","12","1000","unico","#24 Descuento lote 600 ; #95 Descuento Nivel II lote 1000"
"77410433508451","26118","simple","Balsamo de Cebolla y Romero Copacabana 500ml","3490,00","3","800","12","1500","unico","#31 Descuento lote 800 ; #113 Descuento Nivel II lote 1500"
"76041280254-5","26407","simple","Balsamo de frutilla 2 en 1","1100","3","300","12","500","unico","#9 Descuento lote 300 ; #66 Descuento Nivel II lote 500"
"77394772972099","15926","simple","Balsamo De Keratina Hidrolizada 500ml","3490","3","800","12","1500","unico","#31 Descuento lote 800 ; #113 Descuento Nivel II lote 1500"
"6975222513970","3823","simple","Bálsamo de labios de Frutilla","1000","3","250","12","450","unico","#8 Descuento lote 250 ; #62 Descuento Nivel II lote 450"
"6941804213064","30381","variable","Balsamo de labios Game-on Romantic Beauty","","3","500","12","1000","unico","#19 Descuento lote 500 ; #95 Descuento Nivel II lote 1000"
"8800577010103","30586","variable","Balsamo de labios hidratante Fresh Juicy Ushas","","3","500","12","1000","unico","#19 Descuento lote 500 ; #95 Descuento Nivel II lote 1000"
"8800577007417","27284","variable","Balsamo de labios hidratante Max belle","","3","500","12","1000","unico","#19 Descuento lote 500 ; #95 Descuento Nivel II lote 1000"
"8800577009749","29339","variable","Balsamo de labios metalizado Febble 10.8g","","3","500","12","1000","unico","#19 Descuento lote 500 ; #95 Descuento Nivel II lote 1000"
"6985356780575","25028","simple","Balsamo De Labios Ositos","1990","3","500","12","1000","unico","#19 Descuento lote 500 ; #95 Descuento Nivel II lote 1000"
"6952154875994","34527","simple","Balsamo de labios Pingüino","1990","3","500","12","1000","unico","#19 Descuento lote 500 ; #95 Descuento Nivel II lote 1000"
"8800577009503","41937","variable","Balsamo Desmaquillante Ushas","","3","1000",,,"unico","#37 Descuento lote 1000"
"77394882940941","17550","simple","Balsamo Hello Kitty","3590","3","800","12","1500","unico","#31 Descuento lote 800 ; #113 Descuento Nivel II lote 1500"
"8800577015030","32401","variable","Bálsamo hidratante con color Febble 10.8g","","3","500","12","1000","unico","#19 Descuento lote 500 ; #95 Descuento Nivel II lote 1000"
"8800577003235","26384","simple","Balsamo hidratante de labios Ushas","1890,00","3","500","12","1000","unico","#19 Descuento lote 500 ; #95 Descuento Nivel II lote 1000"
"6323956080013","34954","variable","Bálsamo Labial Bubbaluu 4.5gr","","3","400","12","800","unico","#14 Descuento lote 400 ; #83 Descuento Nivel II lote 800"
"8800577019380","39020","simple","Bálsamo Labial Coconut Oil","1790","3","500","12","1000","unico","#19 Descuento lote 500 ; #95 Descuento Nivel II lote 1000"
"8800577003044","22396","variable","Balsamo Labial Magico Botella De Leche Flamenco","","3","700","12","1000","unico","#28 Descuento lote 700 ; #95 Descuento Nivel II lote 1000"
"8800577012817","27024","simple","Balsamo labial magico flamenco","2500",,,"12","1000","unico","#95 Descuento Nivel II lote 1000"
"6976623805039","34998","variable","Bálsamo Labial Sadoer 7g","","3","500","12","800","unico","#19 Descuento lote 500 ; #83 Descuento Nivel II lote 800"
"8800577010127","29805","simple","Balsamo magico Jelly Febble","2600","3","500","12","1000","unico","#19 Descuento lote 500 ; #95 Descuento Nivel II lote 1000"
"6941804212012","26740","simple","Balsamo magico Romantic Beauty","2190,00","3","500","12","1000","unico","#19 Descuento lote 500 ; #95 Descuento Nivel II lote 1000"
"77392871066076","10563","simple","Balsamo Oroplex N4 Bond Maintenance 500ml","3490","3","800","12","1500","unico","#31 Descuento lote 800 ; #113 Descuento Nivel II lote 1500"
"77427810779303","23390","simple","Balsamo Ortiga Y Romero Reania 500Ml","3990","3","600","12","1000","unico","#24 Descuento lote 600 ; #95 Descuento Nivel II lote 1000"
"6925346332452","35118","simple","Bálsamo para Barba Sadoer 20g","2700","3","500","12","1000","unico","#19 Descuento lote 500 ; #95 Descuento Nivel II lote 1000"
"77427990516798","28507","simple","Balsamo Rizos Naturales Reania.y 500ml","3990,00","3","600","12","1000","unico","#24 Descuento lote 600 ; #95 Descuento Nivel II lote 1000"
"77428091958837","28512","simple","Balsamo Suero De Arroz Reania.y 500ml","3990,00","3","600","12","1000","unico","#24 Descuento lote 600 ; #95 Descuento Nivel II lote 1000"
"8800577006670","25760","variable","Balsamo voluminizador de labios Ushas","","3","500","12","1000","unico","#19 Descuento lote 500 ; #95 Descuento Nivel II lote 1000"
"6323956021290","33468","simple","Bandas Depilatorias Bubbaluu","2490","3","500","12","1000","unico","#19 Descuento lote 500 ; #95 Descuento Nivel II lote 1000"
"9669669104705","17426","simple","Bandeja Esterilizadora","5990","3","1000","12","2000","unico","#37 Descuento lote 1000 ; #161 Descuento Nivel II lote 2000"
"7822456338321","17368","simple","Bandeja Mezcladora De Corazon Tornasol","3490","3","500","12","1000","unico","#19 Descuento lote 500 ; #95 Descuento Nivel II lote 1000"
"7805250660003","26402","simple","Base blooming gel Cherimoya","3800,00","3","500","12","1000","unico","#19 Descuento lote 500 ; #95 Descuento Nivel II lote 1000"
"6924372654026","6257","variable","Base De Maquillaje Care Flamenco","","3","500","12","1000","unico","#19 Descuento lote 500 ; #95 Descuento Nivel II lote 1000"
"6903072424115","22971","variable","Base De Maquillaje Fit Skin Karite","","3","500","12","1000","unico","#19 Descuento lote 500 ; #95 Descuento Nivel II lote 1000"
"6903072435616","23967","variable","Base de maquillaje Kiss Beauty 50ml","","3","500","12","1000","unico","#19 Descuento lote 500 ; #95 Descuento Nivel II lote 1000"
"760412299460","19425","variable","Base De Maquillaje Liquida Max Belle","","3","500","12","1000","unico","#19 Descuento lote 500 ; #95 Descuento Nivel II lote 1000"
"6971764129679-5","26386","variable","Base de maquillaje Matte Febble","",,,"12","1000","unico","#95 Descuento Nivel II lote 1000"
"6924372631294","22983","variable","Base De Maquillaje Sas","","3","500","12","1000","unico","#19 Descuento lote 500 ; #95 Descuento Nivel II lote 1000"
"6903072428144","23838","variable","Base De Maquillaje Soft Touch Karite","","3","500","12","1000","unico","#19 Descuento lote 500 ; #95 Descuento Nivel II lote 1000"
"683609867566","9276","variable","Base Flawless Stay Beauty Creations","","3","1000",,,"unico","#37 Descuento lote 1000"
"760412335236","39067","variable","Base liquida flamenco","","3","500","12","1000","unico","#19 Descuento lote 500 ; #95 Descuento Nivel II lote 1000"
"7805251150008","22017","simple","Base Overlay Cherimoya","4990","3","500","12","1000","unico","#19 Descuento lote 500 ; #95 Descuento Nivel II lote 1000"
"6915441019044","24766","variable","Base Rubber Vicky Nails 12Ml","","3","500","12","1000","unico","#19 Descuento lote 500 ; #95 Descuento Nivel II lote 1000"
"8588988727208","17662","simple","Bigudies De Cabello Ref:72720","1990",,,"12","1000","unico","#95 Descuento Nivel II lote 1000"
"8588988727246","17664","simple","Bigudies De Cabello Ref:72724","1700","3","400","12","900","unico","#14 Descuento lote 400 ; #88 Descuento Nivel II lote 900"
"8588988727260","17663","simple","Bigudies De Cabello Ref:72726","1700","3","400","12","900","unico","#14 Descuento lote 400 ; #88 Descuento Nivel II lote 900"
"760412290306","7901","simple","Bolsa De Esponjas De Maquillaje 25U.","2190","3","600","12","1100","unico","#24 Descuento lote 600 ; #99 Descuento Nivel II lote 1100"
"8588988795467","27938","simple","Bolsita de mini coles 2cm","1390,00","3","400","12","700","unico","#14 Descuento lote 400 ; #77 Descuento Nivel II lote 700"
"8588988829940","27953","simple","Bolsita de mini coles de colores","1390,00","3","400","12","700","unico","#14 Descuento lote 400 ; #77 Descuento Nivel II lote 700"
"77392666612828","3261","simple","Bomba Capilar Magia De Unicornio","3690","3","600","12","1000","unico","#24 Descuento lote 600 ; #95 Descuento Nivel II lote 1000"
"77386488583648","40705","simple","Bomba de keratina magia unicornio copacabana","3690","3","800","12","1500","unico","#31 Descuento lote 800 ; #113 Descuento Nivel II lote 1500"
"8588988981969","24748","simple","Boob Tape Con Push Up De Silicona","2490","3","500","12","1000","unico","#19 Descuento lote 500 ; #95 Descuento Nivel II lote 1000"
"7822456342700","16851","simple","Botella Aplicadora De Tinte Cabello 250Ml","1790","3","500","12","900","unico","#19 Descuento lote 500 ; #88 Descuento Nivel II lote 900"
"9669669700709","23824","variable","Botella Dispensadora Para Limpieza De Pestañas","","3","500","12","900","unico","#19 Descuento lote 500 ; #88 Descuento Nivel II lote 900"
"9576721047880","40678","simple","Botox Capilar Expert Line Argan 500ml","3490","3","800","12","1500","unico","#31 Descuento lote 800 ; #113 Descuento Nivel II lote 1500"
"9571983551021","3529","simple","Botox Capilar Expert Line Jojoba & Argan 500ml","3490","3","800","12","1500","unico","#31 Descuento lote 800 ; #113 Descuento Nivel II lote 1500"
"9576721241981","40676","simple","Botox Capilar Expert Line Marroqui 500ml","3490","3","800","12","1500","unico","#31 Descuento lote 800 ; #113 Descuento Nivel II lote 1500"
"9576721234211","40680","simple","Botox Capilar Expert Line Monoi 500ml","3490","3","800","12","1500","unico","#31 Descuento lote 800 ; #113 Descuento Nivel II lote 1500"
"9576721726440","40674","simple","Botox Capilar Expert Line Ricino 500ml","3490","3","800","12","1500","unico","#31 Descuento lote 800 ; #113 Descuento Nivel II lote 1500"
"6941349379713","24616","simple","Box Cuidado Facial 6 Pcs Bioaqua De Arroz","19990","3","3000",,,"unico","#50 Descuento lote 3000"
"6976504689239","24615","simple","Box Cuidado Facial 6 Pcs Sadoer De Palta","19990","3","3000",,,"unico","#50 Descuento lote 3000"
"MG0BOXCENTELLA","28936","simple","Box cuidado facial Centella Asiatica 7pcs","19990,00","3","3000",,,"unico","#50 Descuento lote 3000"
"760412311285","31122","simple","Box cuidado facial Vitamina C Flamenco 5pcs","22000","3","3000",,,"unico","#50 Descuento lote 3000"
"6975222515325","11992","simple","Brillo De Labios Bob Esponja","1700","3","500","12","800","unico","#19 Descuento lote 500 ; #83 Descuento Nivel II lote 800"
"8800577003624","28432","simple","Brillo de labios Flamenco","2190,00","3","500","12","1000","unico","#19 Descuento lote 500 ; #95 Descuento Nivel II lote 1000"
"760412299330","22400","simple","Brillo De Labios Flamenco Caramelo","2190",,,"12","790","unico","#82 Descuento Nivel II lote 790"
"760412299385","20398","variable","Brillo De Labios Glow Cherry","","3","500","12","1000","unico","#19 Descuento lote 500 ; #95 Descuento Nivel II lote 1000"
"6975222513543","11990","simple","Brillo De Labios Hello Kitty Glitter","1990","3","500","12","1000","unico","#19 Descuento lote 500 ; #95 Descuento Nivel II lote 1000"
"6941804203553","19887","simple","Brillo De Labios Juicy Lips Romantic","2190","3","500","12","1000","unico","#19 Descuento lote 500 ; #95 Descuento Nivel II lote 1000"
"8800577008001","28428","simple","Brillo de labios Lip oil Flamenco 4ml","2190,00","3","500","12","1000","unico","#19 Descuento lote 500 ; #95 Descuento Nivel II lote 1000"
"6971836879716","19651","simple","Brillo De Labios Magico Sandia","1990","3","500","12","1000","unico","#19 Descuento lote 500 ; #95 Descuento Nivel II lote 1000"
"6941804203515","19038","variable","Brillo De Labios Metalizado Romantic Tono A","","3","500","12","1000","unico","#19 Descuento lote 500 ; #95 Descuento Nivel II lote 1000"
"6941804203552","19054","variable","Brillo De Labios Metalizado Romantic Tono B","","3","500","12","1000","unico","#19 Descuento lote 500 ; #95 Descuento Nivel II lote 1000"
"6941804202396","18951","variable","Brillo De Labios Plump Volume Shine","","3","500","12","1000","unico","#19 Descuento lote 500 ; #95 Descuento Nivel II lote 1000"
"8800577002634","27027","simple","Brillo de labios roll on Max belle","1990,00","3","500","12","1000","unico","#19 Descuento lote 500 ; #95 Descuento Nivel II lote 1000"
"6941804201115","19647","simple","Brillo De Labios Rosa Glitter Romantic","2290","3","500","12","1000","unico","#19 Descuento lote 500 ; #95 Descuento Nivel II lote 1000"
"760412263584","11981","variable","Brillo De Labios Shine Mini Flamenco","","3","500","12","800","unico","#19 Descuento lote 500 ; #83 Descuento Nivel II lote 800"
"8800577008933","33789","simple","Brillo de labios Super Stay Fruits","2190","3","500","12","1000","unico","#19 Descuento lote 500 ; #95 Descuento Nivel II lote 1000"
"8800577009701","29809","simple","Brillo de labios Ushas Juicy","2290,00","3","500","12","1000","unico","#19 Descuento lote 500 ; #95 Descuento Nivel II lote 1000"
"6960037160037","9972","variable","Brillo De Labios Victoria´S Spirit","","3","500","12","1000","unico","#19 Descuento lote 500 ; #95 Descuento Nivel II lote 1000"
"8800577015214","33644","variable","Brillo Labial con Colgante Ushas 11g","","3","500","12","1000","unico","#19 Descuento lote 500 ; #95 Descuento Nivel II lote 1000"
"8800577010745","33110","variable","Brillo Labial con Color Shiny Flamenco","","3","500","12","1000","unico","#19 Descuento lote 500 ; #95 Descuento Nivel II lote 1000"
"8800577015566","34984","variable","Brillo Labial con Destellos Flamenco","","3","500","12","1000","unico","#19 Descuento lote 500 ; #95 Descuento Nivel II lote 1000"
"8800577011728","33101","variable","Brillo labial con destellos Ushas","","3","500","12","1000","unico","#19 Descuento lote 500 ; #95 Descuento Nivel II lote 1000"
"69762891933659","38243","variable","Brillo labial con llavero","",,,"12","1200","unico","#104 Descuento Nivel II lote 1200"
