"SKU","ID","Tipo","Nombre","Precio normal","_bgm_min_1","_bgm_descuento_1","_bgm_min_2","_bgm_descuento_2","_bgm_modo_descuento","reglas"
"MG0020TONOSHK","22819","simple","Paleta De Sombras 20 Tonos Hello Kitty","7990","3","2000",,,"unico","#141 Descuento lote 2000"
"8800577008940","30602","variable","Paleta de sombras 9 tonos max belle","","3","500","12","1000","unico","#19 Descuento lote 500 ; #95 Descuento Nivel II lote 1000"
"8800577008377","28410","variable","Paleta de sombras con rubor Showtime Dream","","3","1000",,,"unico","#37 Descuento lote 1000"
"8800577014125","30598","simple","Paleta de sombras corazones Ushas 18 tonos","3990","3","700","12","1200","unico","#28 Descuento lote 700 ; #104 Descuento Nivel II lote 1200"
"683609853033","9592","simple","Paleta De Sombras Dare To Be Bright Bossy","8990","3","1000",,,"unico","#37 Descuento lote 1000"
"603149303621","10292","simple","Paleta De Sombras Eye Bloom  Beauty Creations","9990","3","1000",,,"unico","#37 Descuento lote 1000"
"8800577008964","30049","simple","Paleta de sombras Eyeshadow Color play Max belle 26 tonos","5990",,,"12","1000","unico","#95 Descuento Nivel II lote 1000"
"6924372633083","34359","variable","Paleta de Sombras Hello Kitty SAS","","3","800","12","1300","unico","#31 Descuento lote 800 ; #108 Descuento Nivel II lote 1300"
"6976289193648","21601","simple","Paleta De Sombras Kevin Y Coco 9 Colores Naranja","3990","3","1000","12","1500","unico","#37 Descuento lote 1000 ; #113 Descuento Nivel II lote 1500"
"6976289193662","28958","simple","Paleta de sombras Kevin y Coco 9 tonos","3990,00","3","1000","12","1500","unico","#37 Descuento lote 1000 ; #113 Descuento Nivel II lote 1500"
"8800577009039","30060","variable","Paleta de sombras Max belle 16 tonos","","3","500","12","1000","unico","#19 Descuento lote 500 ; #95 Descuento Nivel II lote 1000"
"8800577009046","30073","variable","Paleta de sombras Max belle 5 tonos","","3","500","12","1000","unico","#19 Descuento lote 500 ; #95 Descuento Nivel II lote 1000"
"8588988824716","22734","simple","Palito De Naranjo 10Pcs","1000","3","250","12","500","unico","#8 Descuento lote 250 ; #66 Descuento Nivel II lote 500"
"8588988824709","22737","simple","Palito De Naranjo 30Pcs","1890","3","500","12","900","unico","#19 Descuento lote 500 ; #88 Descuento Nivel II lote 900"
"8588988655532","17717","simple","Papel Foil Para Uñas Ref:65553","1790","3","500","12","1000","unico","#19 Descuento lote 500 ; #95 Descuento Nivel II lote 1000"
"8588988655631","17716","simple","Papel Foil Para Uñas Ref:65563","1790","3","500","12","1000","unico","#19 Descuento lote 500 ; #95 Descuento Nivel II lote 1000"
"8588988655648","17718","simple","Papel Foil Para Uñas Ref:65564","1790","3","500","12","1000","unico","#19 Descuento lote 500 ; #95 Descuento Nivel II lote 1000"
"8588988896355","20761","variable","Par De Coles De Colores Con Perlas Ref:89635","","3","250","12","500","unico","#8 Descuento lote 250 ; #66 Descuento Nivel II lote 500"
"8588988924881","20874","variable","Par De Coles Para El Cabello Ref: 92488","","3","250","12","500","unico","#8 Descuento lote 250 ; #66 Descuento Nivel II lote 500"
"8588988998097","25399","simple","Parche De Silicona Para Pestañas","1590,00","3","400","12","700","unico","#14 Descuento lote 400 ; #77 Descuento Nivel II lote 700"
"8800577012152","31064","simple","Parches anti acne animalitos Flamenco 30pcs","2400","3","410","12","1000","unico","#15 Descuento lote 410 ; #95 Descuento Nivel II lote 1000"
"8800577016853","31053","simple","Parches anti acne estrella Flamenco 46pcs","2400","3","410","12","1000","unico","#15 Descuento lote 410 ; #95 Descuento Nivel II lote 1000"
"8800577016846","31031","simple","Parches anti acne Flores y corazones Flamenco 48pcs","2400","3","410","12","1000","unico","#15 Descuento lote 410 ; #95 Descuento Nivel II lote 1000"
"760412299262","20348","variable","Parches Anti-granitos Flamenco","","3","600","12","1000","unico","#24 Descuento lote 600 ; #95 Descuento Nivel II lote 1000"
"6973098898443","26073","variable","Parches de ojeras Sadoer 30 pares","","3","1000","12","1500","unico","#37 Descuento lote 1000 ; #113 Descuento Nivel II lote 1500"
"760412311742","39033","variable","Parches de ojos flamenco 30 pares","","3","700","12","1300","unico","#28 Descuento lote 700 ; #108 Descuento Nivel II lote 1300"
"8588988783914","20672","simple","Parches Desechables Para Lifting O Extensiones De Pestañas","1390","3","400","12","700","unico","#14 Descuento lote 400 ; #77 Descuento Nivel II lote 700"
"8800577016600","34188","simple","Parches Lifting Facial Flamenco","2490","3","500","12","1000","unico","#19 Descuento lote 500 ; #95 Descuento Nivel II lote 1000"
"760412330828","28907","variable","Parches para puntos negros Flamenco 10pcs","","3","500","12","1000","unico","#19 Descuento lote 500 ; #95 Descuento Nivel II lote 1000"
"6976068957911","28908","simple","Parches para puntos negros Sadoer 6pcs","2490,00","3","500","12","1000","unico","#19 Descuento lote 500 ; #95 Descuento Nivel II lote 1000"
"7805250340004","21698","simple","Pegamento De Cristales 15Ml Cherimoya","3800","3","500","12","1000","unico","#19 Descuento lote 500 ; #95 Descuento Nivel II lote 1000"
"6982465646457","21558","simple","Pegamento De Peluca Ghost Bond","4990","3","500","12","1000","unico","#19 Descuento lote 500 ; #95 Descuento Nivel II lote 1000"
"9669669700587","22647","simple","Pegamento De Pestañas Duo Translucido","1790","3","400","12","900","unico","#14 Descuento lote 400 ; #88 Descuento Nivel II lote 900"
"7822456303787","19838","variable","Pegamento De Pestañas Eye","","3","390",,,"unico","#13 Descuento lote 390"
"7702172655677","4307","variable","Pegamento De Pestañas EYE","","3","390","12","590","unico","#13 Descuento lote 390 ; #70 Descuento Nivel II lote 590"
"746817073010","24438","simple","Pegamento De Pestañas Salon Pro 30Ml Original","4990","3","1000",,,"unico","#37 Descuento lote 1000"
"746817073027","24435","simple","Pegamento De Pestañas Salon Pro 60Ml Original","6490","3","1000",,,"unico","#37 Descuento lote 1000"
"760412336097","6339","simple","Pegamento De Piedras Para Uñas","1790","3","500","12","900","unico","#19 Descuento lote 500 ; #88 Descuento Nivel II lote 900"
"760412298098","17338","simple","Pegamento De Uñas 15 Ml","1250","3","200","12","500","unico","#6 Descuento lote 200 ; #66 Descuento Nivel II lote 500"
"760412309961","26390","simple","Pegamento de uñas Max belle 10g","1100","3","400","12","550","unico","#14 Descuento lote 400 ; #69 Descuento Nivel II lote 550"
"77879127333440","12266","simple","Pegamento Para Pestañas por punto Salon Pro 60Ml","3990","3","1000",,,"unico","#37 Descuento lote 1000"
"760412270186","9234","simple","Pegamento Para Uñas Press On","1100","3","250","12","500","unico","#8 Descuento lote 250 ; #66 Descuento Nivel II lote 500"
"760412292218","10592","simple","Pegamento Uñas Soft Gel Flamenco","2390",,,"12","1000","unico","#95 Descuento Nivel II lote 1000"
"8588988943240","23019","variable","Peine De Cabello De Niños Ref: 94324","","3","500","12","1000","unico","#19 Descuento lote 500 ; #95 Descuento Nivel II lote 1000"
"8588988943400","23013","variable","Peine De Cabello De Niños Ref: 94340","","3","500","12","1000","unico","#19 Descuento lote 500 ; #95 Descuento Nivel II lote 1000"
"8588988770099","19147","simple","Peine Negro Ref:77009","800","3","250","12","500","unico","#8 Descuento lote 250 ; #66 Descuento Nivel II lote 500"
"8588988770013","12023","simple","Peine Para El Cabello Negro","1200","3","500","12","800","unico","#19 Descuento lote 500 ; #83 Descuento Nivel II lote 800"
"9669669500156","4302","simple","Perfilador De Cejas","1490","3","590","12","790","unico","#23 Descuento lote 590 ; #82 Descuento Nivel II lote 790"
"9750266132373","36346","variable","Perfume Capilar Everglam 125ml","","3","800","12","1500","unico","#31 Descuento lote 800 ; #113 Descuento Nivel II lote 1500"
"6323956010966","33465","simple","Perfume capilar Shimmer Bubbaluu Tutti Frutti","4990","3","1000","12","2200","unico","#37 Descuento lote 1000 ; #203 Descuento Nivel II lote 2200"
"6323956010959","40898","simple","Perfume capilar Shimmer Bubbaluu Uva","4990","3","1000","12","2200","unico","#37 Descuento lote 1000 ; #203 Descuento Nivel II lote 2200"
"8800577021154","37281","variable","Perfume de cartera con colgante VV","","3","1000","12","1600","unico","#37 Descuento lote 1000 ; #115 Descuento Nivel II lote 1600"
"8800577015887","35557","simple","Perfume de hombre Invincible 100ml","5500,00","3","1000","12","1500","unico","#37 Descuento lote 1000 ; #113 Descuento Nivel II lote 1500"
"8800577015894","35559","simple","Perfume de hombre Invincible Panacea 100ml","5500,00","3","1000","12","1500","unico","#37 Descuento lote 1000 ; #113 Descuento Nivel II lote 1500"
"8800577015900","35562","simple","Perfume de hombre Invincible Triumph 100ml","5500,00","3","1000","12","1500","unico","#37 Descuento lote 1000 ; #113 Descuento Nivel II lote 1500"
"760412266127","26754","simple","Perfume de hombre Max belle 112","5500","3","1000","12","1500","unico","#37 Descuento lote 1000 ; #113 Descuento Nivel II lote 1500"
"760412266165","26756","simple","Perfume de hombre Max belle 116","5500,00","3","1000","12","1500","unico","#37 Descuento lote 1000 ; #113 Descuento Nivel II lote 1500"
"760412266066","26752","simple","Perfume de hombre Max belle 412","5500,00","3","1000","12","1500","unico","#37 Descuento lote 1000 ; #113 Descuento Nivel II lote 1500"
"8800577015849","35555","simple","Perfume de mujer Belle Femme Shimmer 100ml","5500,00","3","1000","12","1500","unico","#37 Descuento lote 1000 ; #113 Descuento Nivel II lote 1500"
"8800577015832","35551","simple","Perfume de mujer Je t'aime 100ml","5500,00","3","1000","12","1500","unico","#37 Descuento lote 1000 ; #113 Descuento Nivel II lote 1500"
"8800577015801","35553","simple","Perfume de mujer Magical Star Lucky 100ml","5500,00","3","1000","12","1500","unico","#37 Descuento lote 1000 ; #113 Descuento Nivel II lote 1500"
"760412266462","26110","simple","Perfume de mujer Max belle 208 100ml","5500","3","1000","12","1500","unico","#37 Descuento lote 1000 ; #113 Descuento Nivel II lote 1500"
"760412266486","26760","simple","Perfume de mujer Max belle 210","5500","3","1000","12","1500","unico","#37 Descuento lote 1000 ; #113 Descuento Nivel II lote 1500"
"760412266493","26748","simple","Perfume de mujer Max belle 211","5500","3","1000","12","1500","unico","#37 Descuento lote 1000 ; #113 Descuento Nivel II lote 1500"
"760412267025","26759","simple","Perfume de mujer Max belle 313","5500,00","3","1000","12","1500","unico","#37 Descuento lote 1000 ; #113 Descuento Nivel II lote 1500"
"8800577015825","35549","simple","Perfume de mujer Pure Cloud 100ml","5500,00","3","1000","12","1500","unico","#37 Descuento lote 1000 ; #113 Descuento Nivel II lote 1500"
"8800577015818","35527","simple","Perfume de mujer Sweet Cloud 100ml","5500,00","3","1000","12","1500","unico","#37 Descuento lote 1000 ; #113 Descuento Nivel II lote 1500"
"760412266110","26753","simple","Perfume unisex Max belle 111","5500","3","1000","12","1500","unico","#37 Descuento lote 1000 ; #113 Descuento Nivel II lote 1500"
"8588988924836","22723","simple","Perfumeros","1800","3","600","12","900","unico","#24 Descuento lote 600 ; #88 Descuento Nivel II lote 900"
"8800577013128","31065","variable","Pestañas de racimos Flamenco","","3","500",,,"unico","#19 Descuento lote 500"
"6915440102358","17532","simple","Pestañas Forma Y","10000","3","1500","12","2500","unico","#159 Descuento lote 1500 ; #183 Descuento Nivel II lote 2500"
"6915441010478","17534","simple","Pestañas Nagaraku","4990","3","1000","12","2000","unico","#37 Descuento lote 1000 ; #161 Descuento Nivel II lote 2000"
"9669669020166","21280","simple","Pestañas Nagaraku","4990","3","1000","12","2000","unico","#37 Descuento lote 1000 ; #161 Descuento Nivel II lote 2000"
"8588988995324","22744","variable","Pestañas Por Punto Keke","","3","500","12","1000","unico","#19 Descuento lote 500 ; #95 Descuento Nivel II lote 1000"
"9669669804100","19662","variable","Pestañas Postizas Kawaii","","3","400","12","700","unico","#14 Descuento lote 400 ; #77 Descuento Nivel II lote 700"
"8800577018512","39053","variable","Petalos removedor de esmalte","","3","400","12","800","unico","#14 Descuento lote 400 ; #83 Descuento Nivel II lote 800"
"MB008011","17321","simple","Petalos Removedores De Esmalte","1290","3","300","12","500","unico","#9 Descuento lote 300 ; #66 Descuento Nivel II lote 500"
"760412291723","8770","variable","Piedras Autoadhesivas Ref: 7003","","3","400","12","600","unico","#14 Descuento lote 400 ; #158 Descuento Nivel II lote 600"
"6323956011055","40873","simple","Pigmento Colores Fantasía Bubbaluu 280ml Azul","4500","3","1000","12","1800","unico","#37 Descuento lote 1000 ; #119 Descuento Nivel II lote 1800"
"6323956011048","40906","simple","Pigmento Colores Fantasía Bubbaluu 280ml Fucsia","4500","3","1000","12","1800","unico","#37 Descuento lote 1000 ; #119 Descuento Nivel II lote 1800"
"6323956011079","40908","simple","Pigmento Colores Fantasía Bubbaluu 280ml Morado","4500","3","1000","12","1800","unico","#37 Descuento lote 1000 ; #119 Descuento Nivel II lote 1800"
"6323956011062","40076","simple","Pigmento Colores Fantasía Bubbaluu 280ml Rojo","4500","3","1000","12","1800","unico","#37 Descuento lote 1000 ; #119 Descuento Nivel II lote 1800"
"6323956011130","40876","simple","Pigmento Colores Fantasía Bubbaluu 280ml Rosado","4500","3","1000","12","1800","unico","#37 Descuento lote 1000 ; #119 Descuento Nivel II lote 1800"
"6323956011109","40882","simple","Pigmento Colores Fantasía Bubbaluu 280ml Turquesa","4500","3","1000","12","1800","unico","#37 Descuento lote 1000 ; #119 Descuento Nivel II lote 1800"
"6323956011093","40878","simple","Pigmento Colores Fantasía Bubbaluu 280ml Verde","4500","3","1000","12","1800","unico","#37 Descuento lote 1000 ; #119 Descuento Nivel II lote 1800"
"760412295110","4159","simple","Pincel Abanico","2200","3","600","12","1000","unico","#24 Descuento lote 600 ; #95 Descuento Nivel II lote 1000"
"8800577002320","22835","simple","Pincel Abanico Flamenco","2100","3","500","12","1000","unico","#19 Descuento lote 500 ; #95 Descuento Nivel II lote 1000"
"9003146676895","20479","simple","Pincel De Polygel Cherimoya #08","2800","3","500",,,"unico","#19 Descuento lote 500"
"8800577002283","22832","simple","Pincel De Uñas Lengua de Gato Flamenco Mb021315","2100","3","500","12","1000","unico","#19 Descuento lote 500 ; #95 Descuento Nivel II lote 1000"
"8800577002238","22829","simple","Pincel De Uñas para Acrilico #4 Flamenco","2500","3","500","12","1000","unico","#19 Descuento lote 500 ; #95 Descuento Nivel II lote 1000"
"8800577002375","22833","simple","Pincel De Uñas Para Degrade Flamenco Mb021324","2100","3","500","12","1000","unico","#19 Descuento lote 500 ; #95 Descuento Nivel II lote 1000"
"77325962955940","17393","simple","Pincel Liner 7Mm Cherimoya","2490","3","500","12","1000","unico","#19 Descuento lote 500 ; #95 Descuento Nivel II lote 1000"
"9003125676892","17351","simple","Pincel Para Degrade Cherimoya","2990","3","500","12","1000","unico","#19 Descuento lote 500 ; #95 Descuento Nivel II lote 1000"
"0760412295363","17385","simple","Pincel Para Degrade Max Belle","2790","3","500","12","1000","unico","#19 Descuento lote 500 ; #95 Descuento Nivel II lote 1000"
"8800577002269","22834","simple","Pincel Pata De Cabra Flamenco","2100","3","500","12","1000","unico","#19 Descuento lote 500 ; #95 Descuento Nivel II lote 1000"
"7822456329206","17374","simple","Pincel Toma Cristales","2490",,,"12","900","unico","#88 Descuento Nivel II lote 900"
"8588988986018","22676","simple","Pinche Brillante Para El Cabello Ref: 98601","1000","3","250","12","500","unico","#8 Descuento lote 250 ; #66 Descuento Nivel II lote 500"
"8588981087347","27771","simple","Pinche de cabello perlado Ref: 108734","1490","3","400","12","700","unico","#14 Descuento lote 400 ; #77 Descuento Nivel II lote 700"
"8588988666507","16812","simple","Pinches De Hello Kitty Ref:66650","1000","3","250","12","500","unico","#8 Descuento lote 250 ; #66 Descuento Nivel II lote 500"
"8588988666132","17693","simple","Pinches De Mickey Ref:66613","1000","3","250","12","500","unico","#8 Descuento lote 250 ; #66 Descuento Nivel II lote 500"
"8588988666040","16796","simple","Pinches Para Niña Ref:66604","1390","3","400","12","700","unico","#14 Descuento lote 400 ; #77 Descuento Nivel II lote 700"
"6931848030697","27366","simple","Pinta carita Blanco 19ml Halloween","1600,00","3","400","12","800","unico","#14 Descuento lote 400 ; #83 Descuento Nivel II lote 800"
"9786062063061","27367","simple","Pinta carita Negro 25ml Halloween","1600,00","3","400","12","800","unico","#14 Descuento lote 400 ; #83 Descuento Nivel II lote 800"
"6931848030680-1","27369","variable","Pinta Caritas Neon 14ml Halloween","","3","400","12","800","unico","#14 Descuento lote 400 ; #83 Descuento Nivel II lote 800"
"9669669300541","20676","simple","Pinza De Pestañas Ref:30054","1790","3","500","12","900","unico","#19 Descuento lote 500 ; #88 Descuento Nivel II lote 900"
"9005139676899","22652","variable","Pinzas De Cejas Cherimoya","","3","500","12","900","unico","#19 Descuento lote 500 ; #88 Descuento Nivel II lote 900"
"8588988810399","17692","simple","Pinzas De Peluqueria 12Pcs Ref:81039","1990","3","500","12","1000","unico","#19 Descuento lote 500 ; #95 Descuento Nivel II lote 1000"
"8588988810412","17691","simple","Pinzas De Peluqueria Blanco Y Negro Ref:81041","1990","3","500","12","1000","unico","#19 Descuento lote 500 ; #95 Descuento Nivel II lote 1000"
"8588988616939","17320","simple","Pinzas Para Uñas Polygel Pack 10 Unid","2500","3","500",,,"unico","#19 Descuento lote 500"
"8588988796631","18590","simple","Pinzas Removedoras Ref: 79662","2090","3","400","12","1000","unico","#14 Descuento lote 400 ; #95 Descuento Nivel II lote 1000"
"8588988799090","16804","simple","Piojitos De Cabello Ref:79909","1300","3","400","12","700","unico","#14 Descuento lote 400 ; #77 Descuento Nivel II lote 700"
"8588988711702","5999","variable","Piojitos Para El Cabello Corazon Y Estrella","","3","400","12","700","unico","#14 Descuento lote 400 ; #77 Descuento Nivel II lote 700"
"8588988723764","10413","variable","Piojitos Para El Cabello Negro","","3","400","12","700","unico","#14 Descuento lote 400 ; #77 Descuento Nivel II lote 700"
"9669669103067","17425","simple","Plantilla De Stamping Ref: 10306","2090","3","400","12","1000","unico","#14 Descuento lote 400 ; #95 Descuento Nivel II lote 1000"
"8588988758943","17713","simple","Plantilla Para Timbre Ref:75894","2090","3","400","12","1000","unico","#14 Descuento lote 400 ; #95 Descuento Nivel II lote 1000"
"760412263622","16601","simple","Plumon Color Negro Flamenco","2290","3","500","12","1000","unico","#19 Descuento lote 500 ; #95 Descuento Nivel II lote 1000"
"760412336257","41810","simple","Plumon Delineador Blanco Flamenco","1990","3","500","12","1000","unico","#19 Descuento lote 500 ; #95 Descuento Nivel II lote 1000"
"760412302276","10976","simple","Plumon Delineador Febble","2100",,,"12","1000","unico","#95 Descuento Nivel II lote 1000"
"8800577062485","26388","simple","Plumon delineador negro Flamenco","2490,00","3","500","12","1000","unico","#19 Descuento lote 500 ; #95 Descuento Nivel II lote 1000"
"8800577002085","11984","simple","Plumones Color Café Flamenco","2100","3","500","12","1000","unico","#19 Descuento lote 500 ; #95 Descuento Nivel II lote 1000"
"6924372601228","6327","variable","Plumones De Color Flamenco","",,,"12","1000","unico","#95 Descuento Nivel II lote 1000"
"760412337155","11983","variable","Plumones Metalizados De Colores Flamenco","","3","500","12","1000","unico","#19 Descuento lote 500 ; #95 Descuento Nivel II lote 1000"
"760412328016","17411","variable","Polvo Acrilico 10Gr Max Belle","","3","400","12","700","unico","#14 Descuento lote 400 ; #77 Descuento Nivel II lote 700"
"6942229800174","22951","variable","Polvo Compacto Hello Kitty","","3","500","12","1000","unico","#19 Descuento lote 500 ; #95 Descuento Nivel II lote 1000"
"8800577014989","34992","variable","Polvo Compacto Matte Max Belle","","3","500","12","1000","unico","#19 Descuento lote 500 ; #95 Descuento Nivel II lote 1000"
"8800577013951","30432","variable","Polvo compacto Ushas Hide pores","","3","500","12","1000","unico","#19 Descuento lote 500 ; #95 Descuento Nivel II lote 1000"
"8800577015146","33398","variable","Polvo Compacto y Corrector Natural Ushas","","3","500","12","1200","unico","#19 Descuento lote 500 ; #104 Descuento Nivel II lote 1200"
"6975222510603","8263","simple","Polvo De Hadas Roll On","1990","3","500","12","1000","unico","#19 Descuento lote 500 ; #95 Descuento Nivel II lote 1000"
"8800577007592","28939","variable","Polvo de hadas Stars Shining Max belle","","3","800","12","1500","unico","#31 Descuento lote 800 ; #113 Descuento Nivel II lote 1500"
"7804947002928","32600","simple","Polvo Decolorante Rizzo 30gr","1790","3","400",,,"unico","#14 Descuento lote 400"
"760412338176","24754","variable","Polvo Fijador Con Brillo Ushas","","3","500","12","1000","unico","#19 Descuento lote 500 ; #95 Descuento Nivel II lote 1000"
"8800577009190","32122","variable","Polvo fijador Flamenco","","3","500","12","1000","unico","#19 Descuento lote 500 ; #95 Descuento Nivel II lote 1000"
"8800577007813","29806","simple","Polvo fijador Flamenco Stay Matte","2700","3","500","12","1000","unico","#19 Descuento lote 500 ; #95 Descuento Nivel II lote 1000"
"8800577006748","33380","simple","Polvo Fijador Max Belle","2490","3","500","12","1000","unico","#19 Descuento lote 500 ; #95 Descuento Nivel II lote 1000"
"6972544607110","1986","simple","Polvo Suelto Loose Powder","2700","3","500","12","1000","unico","#19 Descuento lote 500 ; #95 Descuento Nivel II lote 1000"
"8800577013999","30400","simple","Polvo suelto Rosado Ushas","2990","3","500","12","1000","unico","#19 Descuento lote 500 ; #95 Descuento Nivel II lote 1000"
"6972062189549","26202","simple","Polvo texturizador Rocco","3690","3","500",,,"unico","#19 Descuento lote 500"
"8800577013982","30403","simple","Polvo translucido  2 en 1 Ushas","3490","3","800","12","1200","unico","#31 Descuento lote 800 ; #104 Descuento Nivel II lote 1200"
"6941804203454","17536","variable","Polvo Traslucido Rb","",,,"12","1000","unico","#95 Descuento Nivel II lote 1000"
"8800577014026","30595","simple","Polvo traslucido Ushas Oil control 16H","2490","3","500","12","1000","unico","#19 Descuento lote 500 ; #95 Descuento Nivel II lote 1000"
"7805250050033","26096","variable","Polygel Cherimoya 50ml","","3","500","12","1000","unico","#19 Descuento lote 500 ; #95 Descuento Nivel II lote 1000"
"9669669812853","21841","variable","Porta Credenciales Stitch Ref: 81285","","3","500","12","1000","unico","#19 Descuento lote 500 ; #95 Descuento Nivel II lote 1000"
"6915440124978","17367","variable","Posa Manos Corazones","","3","500","12","1000","unico","#19 Descuento lote 500 ; #95 Descuento Nivel II lote 1000"
"7805250040133","21690","variable","Powder Gel-Polygel Cherimoya 30G","","3","500","12","1000","unico","#19 Descuento lote 500 ; #95 Descuento Nivel II lote 1000"
"7805250300008","18257","simple","Press Gel Líquido 15Gr Cherimoya","3800","3","500",,,"unico","#19 Descuento lote 500"
"6975975013451","33966","simple","Primer de Maquillaje Hello Kitty 30ml","1990","3","500","12","1000","unico","#19 Descuento lote 500 ; #95 Descuento Nivel II lote 1000"
"8800577002061","33524","simple","Primer de Rostro Multipropósito Max Belle","2490","3","500","12","1000","unico","#19 Descuento lote 500 ; #95 Descuento Nivel II lote 1000"
"6971836879594","26074","simple","Primer para sombras Mini Romantic Beauty 9g","2400","3","500","12","1000","unico","#19 Descuento lote 500 ; #95 Descuento Nivel II lote 1000"
"760412332891","1698","simple","Primer Refinador De Poros","2290","3","500","12","1000","unico","#19 Descuento lote 500 ; #95 Descuento Nivel II lote 1000"
"7805250330012","18262","simple","Primer Sin Acido 15Ml Cherimoya","3800","3","500",,,"unico","#19 Descuento lote 500"
"81555979560","9288","variable","Pro. Conceal Hd L.A. Girl","","3","1000",,,"unico","#37 Descuento lote 1000"
"8588988824075","23822","simple","Protector De Rimel Y Delineador","1700","3","400","12","1000","unico","#14 Descuento lote 400 ; #95 Descuento Nivel II lote 1000"
"8588988917807","21251","simple","Protector Para Rimel De Pestañas","1600","3","500","12","900","unico","#19 Descuento lote 500 ; #88 Descuento Nivel II lote 900"
"6942349709890","28926","simple","Protector solar Arroz Bioaqua 40g","2990,00","3","500","12","1000","unico","#19 Descuento lote 500 ; #95 Descuento Nivel II lote 1000"
"6942349717604","28924","simple","Protector solar blanqueador Bioaqua 40g","2990,00","3","500","12","1000","unico","#19 Descuento lote 500 ; #95 Descuento Nivel II lote 1000"
"6942017813171","35199","simple","Protector Solar de Arroz en Spray Bioaqua SPF50+","4890","3","1000","12","1600","unico","#37 Descuento lote 1000 ; #115 Descuento Nivel II lote 1600"
"8800577017539","33612","variable","Protector Solar en Barra Ushas","","3","1000",,,"unico","#37 Descuento lote 1000"
"6323956020996","35188","simple","Protector Solar Hidratante Bubbaluu 100g","3990","3","1000","12","1600","unico","#37 Descuento lote 1000 ; #115 Descuento Nivel II lote 1600"
"6942349727535","28925","simple","Protector solar Raiz de Regaliz Kormesic 60g","3490,00","3","500","12","1000","unico","#19 Descuento lote 500 ; #95 Descuento Nivel II lote 1000"
"77395079938365","9921","simple","Protector Y Alisante Keratin Shock Copacabana 100Ml","3490","3","800","12","1500","unico","#31 Descuento lote 800 ; #113 Descuento Nivel II lote 1500"
"9669669809365","21516","simple","Pulidor En Forma De Corazon","1100","3","250","12","550","unico","#8 Descuento lote 250 ; #69 Descuento Nivel II lote 550"
